{
  "run_id": "20260814-bb-benchmark",
  "methodology": "angle-ideation-agent@1.6.1",
  "critic": "angle-gate-critic@1.6.0",
  "pack_status_recommendation": "Ready for Pre-Lander Agent",
  "revision_loop": 1,
  "preflight": {
    "validate_headlines": "PASS",
    "validate_pack_preflight": "PASS"
  },
  "gates": [
    {
      "gate_id": "I-AVATAR",
      "scope": "pack",
      "result": "PASS",
      "evidence": "mother of a congested newborn whose nights are built around a blocked nose",
      "notes": "fuel.avatar"
    },
    {
      "gate_id": "I-PRODUCT",
      "scope": "pack",
      "result": "PASS",
      "evidence": "Nasal aspirator with a clear collection cup so mucus is visible",
      "notes": ""
    },
    {
      "gate_id": "I-PROBLEM",
      "scope": "pack",
      "result": "PASS",
      "evidence": "Baby nasal congestion prevents sleep and feeding",
      "notes": "00_route"
    },
    {
      "gate_id": "I-FUEL",
      "scope": "pack",
      "result": "PASS",
      "evidence": "product_fit.mechanism present; not UNKNOWN; PLAUSIBLE_INFERENCE",
      "notes": ""
    },
    {
      "gate_id": "I-VOICE",
      "scope": "pack",
      "result": "PASS",
      "evidence": "checking his chest / hospital bulb / mouth suction / feel so mean",
      "notes": "8 vocab phrases"
    },
    {
      "gate_id": "I-BRIEF",
      "scope": "pack",
      "result": "PASS",
      "evidence": "01_mini_brief.json keys avatar through psychosocial_currencies; MB1\u2013MB8",
      "notes": "Scenario B"
    },
    {
      "gate_id": "H1",
      "scope": "all",
      "result": "PASS",
      "evidence": "script:validate_headlines 8/8 max words=11",
      "notes": ""
    },
    {
      "gate_id": "H2",
      "scope": "all",
      "result": "PASS",
      "evidence": "I pressed my ear to his chest and learned nothing.",
      "notes": "past consequence"
    },
    {
      "gate_id": "H3",
      "scope": "all",
      "result": "PASS",
      "evidence": "Mouth suction made help a job only I would take.",
      "notes": ""
    },
    {
      "gate_id": "H4",
      "scope": "all",
      "result": "PASS",
      "evidence": "script: no Baby Bubble in headlines",
      "notes": ""
    },
    {
      "gate_id": "H5",
      "scope": "all",
      "result": "PASS",
      "evidence": "script: no H5 preamble openings",
      "notes": ""
    },
    {
      "gate_id": "H6",
      "scope": "all",
      "result": "PASS",
      "evidence": "Clearing her nose made me feel like I was hurting her.",
      "notes": "confessable; no ad-ese"
    },
    {
      "gate_id": "A-CURRENCY",
      "scope": "all",
      "result": "PASS",
      "evidence": "8 unique: Safety, Partnership, Trust, Agency, Relational, Guilt, Authority, Identity",
      "notes": ""
    },
    {
      "gate_id": "A-CORE",
      "scope": "all",
      "result": "PASS",
      "evidence": "Night sounds don't just wake you \u2014 they steal the ability to know",
      "notes": "no BIAS_*"
    },
    {
      "gate_id": "A-HOLLOW",
      "scope": "angle:1",
      "result": "PASS",
      "evidence": "Ear to a tiny chest, counting rises that never become an answer",
      "notes": ""
    },
    {
      "gate_id": "A-HOLLOW",
      "scope": "angle:8",
      "result": "PASS",
      "evidence": "Only mum is left in the glass",
      "notes": ""
    },
    {
      "gate_id": "A-VILLAIN",
      "scope": "angle:5",
      "result": "PASS",
      "evidence": "The hospital bulb, then the mouth tube, failing in the same night",
      "notes": "v1.6.1 subject is tools not blockage/loop"
    },
    {
      "gate_id": "A-VILLAIN",
      "scope": "angle:8",
      "result": "PASS",
      "evidence": "Just-cope lines \u2014 this is just the newborn stage \u2014 covering for a hospital bulb",
      "notes": "v1.6.1"
    },
    {
      "gate_id": "A-DREAM",
      "scope": "angle:1",
      "result": "PASS",
      "evidence": "by the crib and realise you aren't counting",
      "notes": "place/body"
    },
    {
      "gate_id": "A-DREAM",
      "scope": "angle:4",
      "result": "PASS",
      "evidence": "The unused extras stay in the drawer",
      "notes": "not the cup"
    },
    {
      "gate_id": "A-DREAM",
      "scope": "angle:7",
      "result": "PASS",
      "evidence": "The last advice screenshot stays unopened on the lock screen",
      "notes": "not the cup"
    },
    {
      "gate_id": "A-ARC",
      "scope": "angle:3",
      "result": "PASS",
      "evidence": "The helper had been hiding.",
      "notes": "twist present"
    },
    {
      "gate_id": "A-FIT",
      "scope": "angle:1",
      "result": "PASS",
      "evidence": "clear collection cup makes the mucus visible when it leaves",
      "notes": ""
    },
    {
      "gate_id": "A-DOOR",
      "scope": "all",
      "result": "PASS",
      "evidence": "Dreams peak on crib, drawer, kitchen, chest, lock screen, glass \u2014 not cup inspect",
      "notes": "v1.6.1 F05"
    },
    {
      "gate_id": "A-BELIEF",
      "scope": "pack",
      "result": "PASS",
      "evidence": "fuel ready_to_shift: Seeing the mucus leave is how you know, not hoping",
      "notes": ""
    },
    {
      "gate_id": "A-VOICE",
      "scope": "pack",
      "result": "PASS",
      "evidence": "checking his chest / feel so mean / I said no when he offered",
      "notes": ""
    },
    {
      "gate_id": "P-COUNT",
      "scope": "pack",
      "result": "PASS",
      "evidence": "Contains: 8 angles",
      "notes": ""
    },
    {
      "gate_id": "P-DISTINCT",
      "scope": "pack",
      "result": "PASS",
      "evidence": "knowing vs sealed betrayal vs unshareable mouth vs shopping vs rota vs guilt vs authority vs identity",
      "notes": ""
    },
    {
      "gate_id": "P-FEELS-REAL",
      "scope": "pack",
      "result": "PASS",
      "evidence": "vocab echoes: checking his chest, hospital bulb, mouth suction, feel so mean",
      "notes": "Scenario B plausible"
    },
    {
      "gate_id": "P-CONSISTENCY",
      "scope": "pack",
      "result": "PASS",
      "evidence": "failed_attempts bulb/mouth/electric match villains in angles 2\u20134",
      "notes": ""
    },
    {
      "gate_id": "P-ARTIFACTS",
      "scope": "pack",
      "result": "PASS",
      "evidence": "04_reasoning_chains.json + 03_filter_score_log.json present",
      "notes": ""
    },
    {
      "gate_id": "P-HEADLINES-TABLE",
      "scope": "pack",
      "result": "PASS",
      "evidence": "## Headline Rules Applied H1\u2013H6 Yes",
      "notes": ""
    },
    {
      "gate_id": "P-SUMMARY",
      "scope": "pack",
      "result": "PASS",
      "evidence": "Summary Table 8 rows match body headlines",
      "notes": ""
    },
    {
      "gate_id": "P-CURRENCY-RULES",
      "scope": "pack",
      "result": "PASS",
      "evidence": "SAFETY=chest-check unknown vs TRUST=sealed bulb you cannot wash",
      "notes": "docs/01 \u00a74.1"
    },
    {
      "gate_id": "P-CHAIN-JUDGE",
      "scope": "pack",
      "result": "PASS",
      "evidence": "06_chain_judge.json result PASS revision_loop 1",
      "notes": ""
    },
    {
      "gate_id": "P-GOLD",
      "scope": "pack",
      "result": "PASS",
      "evidence": "06_gold_scores.json pack_mean 4.48 pack_pass true",
      "notes": ""
    },
    {
      "gate_id": "P-ADVERSARY",
      "scope": "pack",
      "result": "PASS",
      "evidence": "07_adversary.json material_hits empty after v1.6.1 regen",
      "notes": ""
    }
  ],
  "cold_reread": {
    "completed": true,
    "failures_found": [],
    "rechecked": [
      "A-VILLAIN",
      "A-DOOR",
      "A-DREAM",
      "P-DISTINCT"
    ],
    "notes": "Loop 1 after F03/F05 hits on first Ready stamp"
  }
}
